{
  "$schema": "https://json-schema.org/draft/2020-12/schema",
  "$id": "https://github.com/inayayousfi/wpt-llm/schemas/source.schema.json",
  "title": "WPT source description (data/sources/<id>/source.json)",
  "type": "object",
  "additionalProperties": false,
  "required": ["schema", "type", "address", "revision", "checksum", "licenses", "formats", "decision"],
  "properties": {
    "schema": {"const": 5, "description": "shape version of this file, for migrations"},
    "type": {"enum": ["http-file", "http-archive", "git", "mercurial", "huggingface", "empty"], "description": "empty: no upstream; the patches hold every file (text written for WPT); huggingface: a dataset repository on huggingface.co, address https://huggingface.co/datasets/<owner>/<name>"},
    "address": {"type": "string", "minLength": 1, "description": "where to fetch it; its sha256 gives the id's hash part"},
    "revision": {"type": "string", "minLength": 1, "description": "git/mercurial/huggingface: full commit hash; http: fetch date YYYY-MM-DD; empty: the date the source was started"},
    "checksum": {"type": "string", "pattern": "^sha256:[0-9a-f]{64}$", "description": "sha256 of the canonical manifest"},
    "extract": {
      "type": "object",
      "additionalProperties": false,
      "properties": {
        "strip": {"type": "integer", "minimum": 0, "description": "leading path components removed from every path"},
        "exclude": {"type": "array", "items": {"$ref": "#/$defs/glob"}, "description": "paths (after strip) left out"},
        "name": {"type": "string", "minLength": 1, "description": "http-file only: the file's path in the manifest"},
        "note": {"type": "string"}
      }
    },
    "history": {
      "type": "object",
      "additionalProperties": false,
      "required": ["since"],
      "description": "git only: the commit history from `since` to `revision`, one file `.git/history/<commit>` per commit without merges, in git format-patch layout, limited to the files `extract` keeps",
      "properties": {
        "since": {"type": "string", "pattern": "^([0-9a-f]{40}|[0-9a-f]{64})$", "description": "the first commit kept: the one from which the repository's root license file holds the license the source lists"}
      }
    },
    "licenses": {
      "type": "array",
      "minItems": 1,
      "items": {
        "type": "object",
        "additionalProperties": false,
        "required": ["license", "paths", "attribution", "text"],
        "properties": {
          "license": {"type": "string", "pattern": "^[A-Za-z0-9.+-]+( WITH [A-Za-z0-9.+-]+)?( (OR|AND) [A-Za-z0-9.+-]+( WITH [A-Za-z0-9.+-]+)?)*$", "description": "SPDX identifier or LicenseRef-<name>, or an expression: alternatives joined by OR, licenses that apply together joined by AND, each optionally WITH an exception"},
          "paths": {"type": "array", "minItems": 1, "items": {"$ref": "#/$defs/glob"}},
          "attribution": {"type": "string", "minLength": 1, "description": "the credit this license asks for, written by a person: authors, title, copyright line, link"},
          "values": {"type": "array", "minItems": 1, "uniqueItems": true, "items": {"type": "string", "minLength": 1}, "description": "records files only: the values of a record's license field that this entry covers, exactly as the records hold them; a record whose value no entry lists is left out"},
          "text": {"type": "string", "minLength": 1, "description": "the license text as the source gives it (its LICENSE file, with its copyright line, and an Apache NOTICE file's content); for LicenseRef-public-domain, why the work is in the public domain. Every model trained on the source carries it in its NOTICE"},
          "note": {"type": "string"}
        }
      }
    },
    "formats": {
      "type": "array",
      "minItems": 1,
      "description": "how each file becomes Markdown for training; every path matches exactly one entry",
      "items": {
        "type": "object",
        "additionalProperties": false,
        "required": ["format", "paths"],
        "properties": {
          "format": {"enum": ["markdown", "text", "xhtml", "code", "chat", "records"], "description": "markdown: kept as is; text: plain text; xhtml: web pages as strict XML (EPUB books); code: a fenced code block naming the language and the path; chat: conversations for the post-training step named by the file's tags, never a pre-training document; records: a JSON Lines (.jsonl, .json, optionally .gz or .zst) or Parquet file holding one document per record, each with its own license"},
          "language": {"type": "string", "pattern": "^[A-Za-z0-9_+#.-]+$", "description": "code only: the language named after the opening fence, for example python"},
          "text": {"$ref": "#/$defs/field", "description": "records only: the field holding the document's text"},
          "as": {"enum": ["text", "markdown"], "description": "records only: whether the text field is plain text (default) or Markdown"},
          "license": {"$ref": "#/$defs/field", "description": "records only: the field holding the record's license, matched against the `values` of the license entries"},
          "id": {"$ref": "#/$defs/field", "description": "records only: the field holding the record's id within its file; without it, the record's position (1 for the first)"},
          "credit": {"type": "array", "minItems": 1, "items": {"$ref": "#/$defs/field"}, "description": "records only: the fields that name the record's authors, title and address, copied into the per-record credit file of every model trained on it"},
          "paths": {"type": "array", "minItems": 1, "items": {"$ref": "#/$defs/glob"}},
          "note": {"type": "string"}
        },
        "allOf": [
          {"if": {"properties": {"format": {"const": "code"}}},
           "then": {"required": ["language"]},
           "else": {"not": {"required": ["language"]}}},
          {"if": {"properties": {"format": {"const": "records"}}},
           "then": {"required": ["text", "license"]},
           "else": {"not": {"anyOf": [{"required": ["text"]}, {"required": ["as"]}, {"required": ["license"]}, {"required": ["id"]}, {"required": ["credit"]}]}}}
        ]
      }
    },
    "tags": {
      "type": "array",
      "items": {
        "type": "object",
        "additionalProperties": false,
        "required": ["tags", "paths"],
        "properties": {
          "tags": {"type": "array", "minItems": 1, "items": {"type": "string", "pattern": "^[a-z0-9][a-z0-9._-]*$"}},
          "paths": {"type": "array", "minItems": 1, "items": {"$ref": "#/$defs/glob"}},
          "note": {"type": "string"}
        }
      }
    },
    "mirrors": {
      "type": "array",
      "items": {
        "type": "object",
        "additionalProperties": false,
        "required": ["address"],
        "properties": {"address": {"type": "string", "minLength": 1}, "note": {"type": "string"}}
      }
    },
    "cuts": {
      "type": "array",
      "items": {
        "type": "object",
        "additionalProperties": false,
        "required": ["path", "start", "end", "sha256_after"],
        "properties": {
          "path": {"type": "string", "minLength": 1},
          "start": {"type": "integer", "minimum": 0, "description": "first removed byte"},
          "end": {"type": "integer", "minimum": 0, "description": "first byte kept after the cut"},
          "sha256_after": {"type": "string", "pattern": "^[0-9a-f]{64}$", "description": "sha256 of the whole file after the cut"},
          "note": {"type": "string"}
        }
      }
    },
    "decision": {
      "type": "object",
      "additionalProperties": false,
      "required": ["decision", "by", "date"],
      "properties": {
        "decision": {"enum": ["admitted", "refused", "retired"]},
        "by": {"type": "string", "minLength": 1},
        "date": {"type": "string", "pattern": "^[0-9]{4}-[0-9]{2}-[0-9]{2}$"},
        "reason": {"type": "string", "minLength": 1, "description": "required to refuse or retire; to admit, only for an exception (such as an explicit permission for content without a license)"},
        "note": {"type": "string"}
      },
      "if": {"properties": {"decision": {"enum": ["refused", "retired"]}}},
      "then": {"required": ["reason"]}
    },
    "note": {"type": "string"}
  },
  "allOf": [
    {
      "if": {"properties": {"type": {"const": "git"}}},
      "then": {"properties": {"revision": {"pattern": "^([0-9a-f]{40}|[0-9a-f]{64})$"}}}
    },
    {
      "if": {"properties": {"type": {"const": "huggingface"}}},
      "then": {"properties": {"revision": {"pattern": "^[0-9a-f]{40}$"}, "address": {"pattern": "^https://huggingface\\.co/datasets/[A-Za-z0-9._-]+/[A-Za-z0-9._-]+$"}}}
    },
    {
      "if": {"properties": {"type": {"const": "mercurial"}}},
      "then": {"properties": {"revision": {"pattern": "^[0-9a-f]{40}$"}}}
    },
    {
      "if": {"properties": {"type": {"enum": ["http-file", "http-archive", "empty"]}}},
      "then": {"properties": {"revision": {"pattern": "^[0-9]{4}-[0-9]{2}-[0-9]{2}$"}}}
    },
    {
      "if": {"properties": {"type": {"const": "empty"}}},
      "then": {
        "properties": {
          "address": {"pattern": "^empty:[a-z0-9][a-z0-9._-]*$", "description": "empty:<name>, a name for the source; nothing is fetched"},
          "checksum": {"const": "sha256:e3b0c44298fc1c149afbf4c8996fb92427ae41e4649b934ca495991b7852b855", "description": "the checksum of an empty manifest"}
        },
        "not": {"anyOf": [{"required": ["extract"]}, {"required": ["mirrors"]}]}
      }
    },
    {
      "if": {"properties": {"type": {"not": {"const": "http-file"}}}},
      "then": {"properties": {"extract": {"not": {"required": ["name"]}}}}
    },
    {
      "if": {"properties": {"type": {"not": {"const": "git"}}}},
      "then": {"not": {"required": ["history"]}}
    }
  ],
  "$defs": {
    "glob": {"type": "string", "minLength": 1, "description": "path pattern: * matches within one folder, ** across folders"},
    "field": {"type": "string", "pattern": "^[^.]+(\\.[^.]+)*$", "description": "a record field; dots go into nested objects, for example metadata.license"}
  }
}
