{
  "schema": 5,
  "type": "git",
  "address": "https://github.com/standardebooks/epictetus_short-works_george-long",
  "revision": "8c154d40a6f85e32a5711001a28c1b55ab56d3c8",
  "checksum": "sha256:77b9686d64990b3defbb36f08ddfcdb311565d300e3d213cf8028be7e4d73cc7",
  "extract": {
    "exclude": [
      "images/**",
      "src/epub/images/**",
      "src/epub/fonts/**"
    ]
  },
  "licenses": [
    {
      "license": "LicenseRef-public-domain",
      "paths": [
        "**"
      ],
      "attribution": "Epictetus, Short Works, translated by George Long. Standard Ebooks edition, produced by Weijia Cheng, https://standardebooks.org/ebooks/epictetus/short-works/george-long",
      "text": "Public domain.\n\nEpictetus died around 135. George Long (1800-1879) translated these works, first published in\n1877 by George Bell, London, United Kingdom.\n\nUnited States: published before 1931. United Kingdom (country of origin): every author and\ntranslator died more than 70 years ago.\n\nStandard Ebooks dedicates its own contributions (markup, corrections) to the public domain under\nCC0 1.0 (the repository's LICENSE.md).\n\nSources: en.wikipedia.org/wiki/George_Long_(scholar).\n"
    }
  ],
  "formats": [
    {
      "format": "xhtml",
      "paths": [
        "**/*.xhtml"
      ]
    },
    {
      "format": "code",
      "language": "css",
      "paths": [
        "**/*.css"
      ]
    },
    {
      "format": "code",
      "language": "xml",
      "paths": [
        "**/*.opf",
        "**/*.xml"
      ]
    },
    {
      "format": "markdown",
      "paths": [
        "**/*.md"
      ]
    },
    {
      "format": "text",
      "paths": [
        "src/mimetype"
      ]
    }
  ],
  "tags": [
    {
      "tags": [
        "en",
        "philosophy"
      ],
      "paths": [
        "**"
      ]
    }
  ],
  "decision": {
    "decision": "admitted",
    "by": "Inaya Yousfi",
    "date": "2026-10-14"
  }
}
